HEADER	ACQ MERCHANT DETAIL           	2025-10-03	22.34.30	
6759	890000	890001	675900000000174 	VERMONT STATE BANK                      	VSB-BANK GROUP                          	5499	5499	VERMONT STATE BANK       	VERMONT      	IL	000061484	3097842271	0000000000	000000000 	0000	0000	6759	0000	390335740	000000000	Y	0000	 	 	 	    	    	    	                	                	0000000000000000	0000000000000000	Y	N	N	N	N	N	N	N	N	N	N	N	N	1000	3	00000000	N	THOMAS HALEY             	                         	                         	                         	390335740	000000000	09/30/2025	10/20/2022	10/20/2022	99/99/9999	99/99/9999	99/99/9999	99/99/9999	N	00036	00	00	00	01	00	00	00	00	00	00	00	00	00	00	00	N	B	M	 	 	 	 	 	 	 	 	 	0000	0000	6124897208	601179750000014	 	 	 	 	 	09/24/2025	N	   	3097842271	2025-10-03 00:00:00	10/20/2022	Y	Y	 	112589	                         	                         	                                        	00/00/0000	          	000000000000000	N	00	00	Y	      	      	      	            	           	2000255          	071122205	 	00000000	10/26/2022	2022/10/26	2025/09/24	 	US	LBILLINGHURST@VERMONTSTATEBANK.COM                                      	lbillinghurst@vermontstatebank.com                                      	N	                                	                 	C	         	0000.00000	N	C	N	N	                                	                 	C	         	000.00000	0000.00000	                                	                 	C	         	000.00000	0000.00000	                                	                 	C	         	000.00000	0000.00000	                                	                 	C	         	000.00000	0000.00000	N	N	N	N	                                                                                                                                                                                                                                                                                                                                                                                  	
6759	890000	890001	675900000000513 	VERMONT STATE BANK                      	VSB-BANK GROUP                          	5499	5499	VERMONT STATE BANK2      	VERMONT      	IL	000061484	3097842271	0000000000	000000000 	0000	0000	6759	0000	390335740	000000000	Y	0000	 	 	 	    	    	    	                	                	0000000000000000	0000000000000000	Y	N	N	N	N	N	N	N	N	N	N	N	N	1000	3	00000000	N	THOMAS HALEY             	                         	                         	                         	390335740	000000000	09/30/2025	10/24/2022	10/24/2022	01/01/2001	99/99/9999	01/01/2001	01/01/2001	N	00036	00	00	00	01	00	00	00	00	00	00	00	00	00	00	00	N	B	M	 	 	 	 	 	 	 	 	 	0000	0000	6124897208	601179750000022	 	 	 	 	 	07/01/2025	N	   	3097842271	2025-10-03 00:00:00	10/24/2022	Y	Y	 	112589	                         	                         	                                        	00/00/0000	          	000000000000000	N	00	00	Y	      	      	      	            	           	2000248          	071122205	 	00000000	10/31/2022	2022/10/31	2025/07/01	 	US	TRIFUSED@GMAIL.COM                                                      	                                                                        	N	                                	                 	C	         	0000.00000	N	C	N	N	                                	                 	C	         	000.00000	0000.00000	                                	                 	C	         	000.00000	0000.00000	                                	                 	C	         	000.00000	0000.00000	                                	                 	C	         	000.00000	0000.00000	N	N	N	N	                                                                                                                                                                                                                                                                                                                                                                                  	
6759	800000	801115	675900000000968 	HIGHER FLOUR LLC                        	ISO LACE GROUP                          	5499	5499	HIGHER FLOUR LLC         	WESLEY CHAPEL	FL	000033544	3134444373	0000000000	000000000 	0000	0000	6759	0000	863838817	000000000	Y	0000	 	 	 	    	    	    	                	                	0000000000000000	0000000000000000	Y	N	N	N	N	N	N	N	N	N	N	N	N	8000	9	00000000	N	BROOKE WAHLQUIST         	BROOKE WAHLQUIST         	                         	                         	591974063	000000000	09/30/2025	11/15/2022	11/15/2022	99/99/9999	99/99/9999	99/99/9999	99/99/9999	N	00035	01	00	00	01	00	00	00	00	00	00	00	00	00	01	00	N	B	M	 	 	 	 	 	 	 	 	 	0000	0000	          	601179750000030	 	 	 	 	 	10/03/2025	N	   	3134444373	2025-10-03 00:00:00	11/15/2022	Y	N	 	000000	                         	                         	                                        	00/00/0000	          	000000000000000	N	00	00	Y	      	      	      	            	           	2000321          	071122205	 	00000000	11/18/2022	2022/11/17	2025/10/03	 	US	HIGHERFLOURLLC@GMAIL.COM                                                	higherflourllc@gmail.com                                                	N	                                	                 	C	         	0000.00000	N	C	N	N	                                	                 	C	         	000.00000	0000.00000	                                	                 	C	         	000.00000	0000.00000	                                	                 	C	         	000.00000	0000.00000	                                	                 	C	         	000.00000	0000.00000	N	N	N	N	                                                                                                                                                                                                                                                                                                                                                                                  	
6759	800000	800888	675900000002154 	K MERCHANTS                             	ISO LACE GROUP                          	5199	5199	DRIP DROP DISTRO LLC     	BOISE        	ID	000083705	5208699697	0000000000	000000000 	0000	0000	6759	0000	471534935	000000000	Y	0000	 	 	 	    	    	    	                	                	0000000000000000	0000000000000000	Y	N	N	N	N	N	N	N	N	N	N	N	N	8000	9	00000000	N	TROY PALMER              	TROY PALMER              	                         	                         	518319512	000000000	09/30/2025	11/15/2022	11/15/2022	99/99/9999	99/99/9999	99/99/9999	99/99/9999	N	00035	00	00	00	01	00	00	00	00	00	00	00	00	00	00	00	N	B	M	 	 	 	 	 	 	 	 	 	0000	0000	          	601179750000055	 	 	 	 	 	10/03/2025	N	   	8009833326	2025-10-03 00:00:00	11/15/2022	Y	N	 	000000	                         	                         	                                        	00/00/0000	          	000000000000000	N	00	00	Y	      	      	      	            	           	832500008100     	123171955	 	00000000	11/25/2022	2022/11/25	2025/10/03	 	US	TROY@DRIPDROPDISTRO.COM                                                 	troy@dripdropdistro.com                                                 	N	                                	                 	C	         	0000.00000	N	C	N	N	                                	                 	C	         	000.00000	0000.00000	                                	                 	C	         	000.00000	0000.00000	                                	                 	C	         	000.00000	0000.00000	                                	                 	C	         	000.00000	0000.00000	N	N	N	N	                                                                                                                                                                                                                                                                                                                                                                                  	
6759	800000	800888	675900000002881 	K MERCHANTS                             	ISO LACE GROUP                          	5499	5499	HAPPY HIPPIE             	SEVIERVILLE  	TN	000037862	8656540830	0000000000	000000000 	0000	0000	6759	0000	814767769	000000000	Y	0000	 	 	 	    	    	    	                	                	0000000000000000	0000000000000000	Y	N	N	N	N	N	N	N	N	N	N	N	N	3000	1	00000000	N	OLIVIA REPPERT           	OLIVIA REPPERT           	                         	                         	410734554	000000000	09/30/2025	11/17/2022	11/17/2022	99/99/9999	99/99/9999	99/99/9999	99/99/9999	N	00035	00	00	00	01	00	00	00	00	00	00	00	00	00	00	00	N	B	M	 	 	 	 	 	 	 	 	 	0000	0000	          	601179750000063	 	 	 	 	 	10/03/2025	N	   	8653663142	2025-10-03 00:00:00	11/17/2022	Y	N	 	000000	                         	                         	                                        	00/00/0000	          	000000000000000	N	00	00	Y	      	      	      	            	           	2000479          	071122205	 	00000000	11/22/2022	2022/11/23	2025/10/03	 	US	HAPPYHIPPIE832@GMAIL.COM                                                	happyhippie832@gmail.com                                                	N	                                	                 	C	         	0000.00000	N	C	N	N	                                	                 	C	         	000.00000	0000.00000	                                	                 	C	         	000.00000	0000.00000	                                	                 	C	         	000.00000	0000.00000	                                	                 	C	         	000.00000	0000.00000	N	N	N	N	                                                                                                                                                                                                                                                                                                                                                                                  	
6759	800000	800888	675900000003707 	K MERCHANTS                             	ISO LACE GROUP                          	5499	5499	MR HEMP FLOWER           	ZEPHYRHILLS  	FL	000033542	4437451432	0000000000	000000000 	0000	0000	6759	0000	833952842	000000000	Y	0000	D	 	 	    	    	    	                	                	0000000000000000	0000000000000000	Y	N	N	N	N	N	N	N	N	N	N	N	N	1000	3	00000000	N	JAMES GOULD              	JAMES GOULD              	                         	                         	215117224	000000000	08/30/2024	11/17/2022	11/17/2022	99/99/9999	99/99/9999	99/99/9999	99/99/9999	N	00022	00	00	00	01	00	00	00	00	00	00	00	00	00	00	00	N	B	M	 	 	 	 	 	 	 	 	 	0000	0000	6124897208	601179750000071	 	 	 	 	 	08/04/2023	N	   	8333877579	2025-10-03 00:00:00	09/20/2024	Y	Y	 	112589	                         	                         	                                        	09/20/2024	          	000000000000000	N	00	00	Y	      	      	      	            	           	2000230          	071122205	 	00000000	11/29/2022	2022/11/29	2023/08/04	 	US	CS@MRHEMPFLOWER.COM                                                     	cs@mrhempflower.com                                                     	N	                                	                 	C	         	0000.00000	N	C	N	N	                                	                 	C	         	000.00000	0000.00000	                                	                 	C	         	000.00000	0000.00000	                                	                 	C	         	000.00000	0000.00000	                                	                 	C	         	000.00000	0000.00000	N	N	N	N	                                                                                                                                                                                                                                                                                                                                                                                  	
6759	800000	800888	675900000004614 	K MERCHANTS                             	ISO LACE GROUP                          	5131	5131	USO GROUP LLC            	BOISE        	ID	000083705	2087248209	0000000000	000000000 	0000	0000	6759	0000	882589387	000000000	Y	0000	D	 	 	    	    	    	                	                	0000000000000000	0000000000000000	Y	N	N	N	N	N	N	N	N	N	N	N	N	8000	9	00000000	N	TROY PALMER              	TROY PALMER              	                         	                         	518319512	000000000	09/30/2024	12/07/2022	12/07/2022	99/99/9999	99/99/9999	99/99/9999	99/99/9999	N	00022	00	00	00	01	00	00	00	00	00	00	00	00	00	00	00	N	B	M	 	 	 	 	 	 	 	 	 	0000	0000	6124897273	601179750000089	 	 	 	 	 	00/00/0000	N	   	2083848588	2025-10-03 00:00:00	10/02/2024	Y	Y	 	112589	                         	                         	                                        	10/02/2024	          	000000000000000	N	00	00	Y	      	      	      	            	           	2000271          	071122205	 	00000000	          	1900/01/01	1900/01/01	 	US	TROY@DRIPDROPDISTRO.COM                                                 	troy@dripdropdistro.com                                                 	N	                                	                 	C	         	0000.00000	N	C	N	N	                                	                 	C	         	000.00000	0000.00000	                                	                 	C	         	000.00000	0000.00000	                                	                 	C	         	000.00000	0000.00000	                                	                 	C	         	000.00000	0000.00000	N	N	N	N	                                                                                                                                                                                                                                                                                                                                                                                  	
6759	800000	800888	675900000005611 	K MERCHANTS                             	ISO LACE GROUP                          	5499	5499	K DIVINE                 	WALTERVILLE  	OR	000097489	5036897182	0000000000	000000000 	0000	0000	6759	0000	473581519	000000000	Y	0000	D	 	 	    	    	    	                	                	0000000000000000	0000000000000000	Y	N	N	N	N	N	N	N	N	N	N	N	N	8000	9	00000000	N	WENDIANNE ROOK           	WENDIANNE ROOK           	                         	                         	010543334	000000000	08/31/2023	01/12/2023	01/12/2023	99/99/9999	99/99/9999	99/99/9999	99/99/9999	N	00008	00	00	00	01	00	00	00	00	00	00	00	00	00	00	00	N	B	M	 	 	 	 	 	 	 	 	 	0000	0000	6124897208	601179750000097	 	 	 	 	 	08/02/2023	N	   	5036897182	2025-10-03 00:00:00	08/04/2023	Y	Y	 	112589	                         	                         	                                        	08/04/2023	          	000000000000000	N	00	00	Y	      	      	      	            	           	2000347          	071122205	 	00000000	01/19/2023	2023/01/19	2023/08/02	 	US	KRATOMDIVINE@GMAIL.COM                                                  	kratomdivine@gmail.com                                                  	N	                                	                 	C	         	0000.00000	N	C	N	N	                                	                 	C	         	000.00000	0000.00000	                                	                 	C	         	000.00000	0000.00000	                                	                 	C	         	000.00000	0000.00000	                                	                 	C	         	000.00000	0000.00000	N	N	N	N	                                                                                                                                                                                                                                                                                                                                                                                  	
6759	800000	800888	675900000005702 	K MERCHANTS                             	ISO LACE GROUP                          	5499	5499	TRADE READY LLC          	LAS VEGAS    	NV	000089169	7023386941	0000000000	000000000 	0000	0000	6759	0000	881060599	000000000	Y	0000	D	 	 	    	    	    	                	                	0000000000000000	0000000000000000	Y	N	N	N	N	N	N	N	N	N	N	N	N	8000	9	00000000	N	ANDREW GENNUSO           	ANDREW GENNUSO           	                         	                         	624487289	000000000	01/31/2024	01/17/2023	01/17/2023	99/99/9999	99/99/9999	99/99/9999	99/99/9999	N	00013	00	00	00	01	00	00	00	00	00	00	00	00	00	00	00	N	B	M	 	 	 	 	 	 	 	 	 	0000	0000	6124897208	601179750000105	 	 	 	 	 	07/14/2023	N	   	7023386941	2025-10-03 00:00:00	02/12/2024	Y	Y	 	112589	                         	                         	                                        	02/12/2024	          	000000000000000	N	00	00	Y	      	      	      	            	           	746044198836     	324377516	 	00000000	02/27/2023	2023/02/27	2023/05/31	 	US	PSILOMART@GMAIL.COM                                                     	psilomart@gmail.com                                                     	N	                                	                 	C	         	0000.00000	N	C	N	N	                                	                 	C	         	000.00000	0000.00000	                                	                 	C	         	000.00000	0000.00000	                                	                 	C	         	000.00000	0000.00000	                                	                 	C	         	000.00000	0000.00000	N	N	N	N	                                                                                                                                                                                                                                                                                                                                                                                  	
6759	800000	800101	675900000005892 	PLANET VAPOR                            	ISO LACE GROUP                          	5999	5999	PLANET VAPOR INC         	COLUMBIA     	SC	000029201	8035462263	0000000000	000000000 	0000	0000	6759	0000	472803059	000000000	Y	0000	D	 	 	    	    	    	                	                	0000000000000000	0000000000000000	Y	N	N	N	N	N	N	N	N	N	N	N	N	1000	3	00000000	N	KEVIN MOORE              	                         	                         	                         	533900030	000000000	09/30/2024	01/27/2023	01/27/2023	99/99/9999	99/99/9999	99/99/9999	99/99/9999	N	00020	02	00	00	01	00	00	00	00	00	00	00	00	00	02	00	N	B	M	 	 	 	 	 	 	 	 	 	0000	0000	6124897208	601179750000113	 	 	 	 	 	08/23/2024	N	   	8035462263	2025-10-03 00:00:00	09/03/2024	Y	Y	 	112589	                         	                         	                                        	09/03/2024	          	000000000000000	N	00	00	Y	      	      	      	            	           	1071101099       	053202208	 	00000000	02/03/2023	2023/02/03	2024/08/23	 	US	KEVIN@MOOREDISTRO.COM                                                   	kevin@mooredistro.com                                                   	N	                                	                 	C	         	0000.00000	N	C	N	N	                                	                 	C	         	000.00000	0000.00000	                                	                 	C	         	000.00000	0000.00000	                                	                 	C	         	000.00000	0000.00000	                                	                 	C	         	000.00000	0000.00000	N	N	N	N	                                                                                                                                                                                                                                                                                                                                                                                  	
6759	800000	800101	675900000006593 	PLANET VAPOR                            	ISO LACE GROUP                          	5999	5999	PLANET VAPOR INC #100    	COLUMBIA     	SC	000029223	0000000000	0000000000	000000000 	0000	0000	6759	0000	472803059	000000000	Y	0000	D	 	 	    	    	    	                	                	0000000000000000	0000000000000000	Y	N	N	N	N	N	N	N	N	N	N	N	N	1000	3	00000000	N	KEVIN MOORE              	                         	                         	                         	000000000	000000000	08/30/2024	02/02/2023	02/02/2023	99/99/9999	99/99/9999	99/99/9999	99/99/9999	N	00019	02	00	00	01	00	00	00	00	00	00	00	00	00	02	00	N	B	M	 	 	 	 	 	 	 	 	 	0000	0000	6124897208	601179750000139	 	 	 	 	 	07/31/2024	N	   	8035462263	2025-10-03 00:00:00	09/03/2024	Y	Y	 	112589	                         	                         	                                        	09/03/2024	          	000000000000000	N	00	00	Y	      	      	      	            	           	1071100351       	053202208	 	00000000	02/10/2023	2023/02/10	2024/07/31	 	US	KEVIN@MOOREDISTRO.COM                                                   	kevin@mooredistro.com                                                   	N	                                	                 	C	         	0000.00000	N	C	N	N	                                	                 	C	         	000.00000	0000.00000	                                	                 	C	         	000.00000	0000.00000	                                	                 	C	         	000.00000	0000.00000	                                	                 	C	         	000.00000	0000.00000	N	N	N	N	                                                                                                                                                                                                                                                                                                                                                                                  	
6759	800000	800101	675900000007088 	PLANET VAPOR                            	ISO LACE GROUP                          	5999	5999	PLANET VAPOR INC #200    	COLUMBIA     	SC	000029209	0000000000	0000000000	000000000 	0000	0000	6759	0000	472803059	000000000	Y	0000	D	 	 	    	    	    	                	                	0000000000000000	0000000000000000	Y	N	N	N	N	N	N	N	N	N	N	N	N	1000	3	00000000	N	KEVIN MOORE              	                         	                         	                         	533900030	000000000	09/30/2024	02/02/2023	02/02/2023	99/99/9999	99/99/9999	99/99/9999	99/99/9999	N	00020	02	00	00	01	00	00	00	00	00	00	00	00	00	02	00	N	B	M	 	 	 	 	 	 	 	 	 	0000	0000	6124897208	601179750000147	 	 	 	 	 	08/09/2024	N	   	8035462263	2025-10-03 00:00:00	09/03/2024	Y	Y	 	112589	                         	                         	                                        	09/03/2024	          	000000000000000	N	00	00	Y	      	      	      	            	           	1071100726       	053202208	 	00000000	02/10/2023	2023/02/10	2024/08/09	 	US	KEVIN@MOOREDISTRO.COM                                                   	kevin@mooredistro.com                                                   	N	                                	                 	C	         	0000.00000	N	C	N	N	                                	                 	C	         	000.00000	0000.00000	                                	                 	C	         	000.00000	0000.00000	                                	                 	C	         	000.00000	0000.00000	                                	                 	C	         	000.00000	0000.00000	N	N	N	N	                                                                                                                                                                                                                                                                                                                                                                                  	
6759	800000	800101	675900000007666 	PLANET VAPOR                            	ISO LACE GROUP                          	5999	5999	PLANET VAPOR INC #300    	COLUMBIA     	SC	000029201	0000000000	0000000000	000000000 	0000	0000	6759	0000	472803059	000000000	Y	0000	D	 	 	    	    	    	                	                	0000000000000000	0000000000000000	Y	N	N	N	N	N	N	N	N	N	N	N	N	1000	3	00000000	N	KEVIN MOORE              	                         	                         	                         	533900030	000000000	09/30/2024	02/02/2023	02/02/2023	99/99/9999	99/99/9999	99/99/9999	99/99/9999	N	00020	02	00	00	01	00	00	00	00	00	00	00	00	00	02	00	N	B	M	 	 	 	 	 	 	 	 	 	0000	0000	6124897208	601179750000154	 	 	 	 	 	08/02/2024	N	   	8035462263	2025-10-03 00:00:00	09/03/2024	Y	Y	 	112589	                         	                         	                                        	09/03/2024	          	000000000000000	N	00	00	Y	      	      	      	            	           	1071101080       	053202208	 	00000000	02/08/2023	2023/02/08	2024/08/02	 	US	KEVIN@MOOREDISTRO.COM                                                   	kevin@mooredistro.com                                                   	N	                                	                 	C	         	0000.00000	N	C	N	N	                                	                 	C	         	000.00000	0000.00000	                                	                 	C	         	000.00000	0000.00000	                                	                 	C	         	000.00000	0000.00000	                                	                 	C	         	000.00000	0000.00000	N	N	N	N	                                                                                                                                                                                                                                                                                                                                                                                  	
6759	800000	800101	675900000008334 	PLANET VAPOR                            	ISO LACE GROUP                          	5999	5999	PLANET VAPOR INC #400    	LEXINGTON    	SC	000029072	0000000000	0000000000	000000000 	0000	0000	6759	0000	472803059	000000000	Y	0000	D	 	 	    	    	    	                	                	0000000000000000	0000000000000000	Y	N	N	N	N	N	N	N	N	N	N	N	N	1000	3	00000000	N	KEVIN MOORE              	                         	                         	                         	533900030	000000000	08/30/2024	02/02/2023	02/02/2023	99/99/9999	99/99/9999	99/99/9999	99/99/9999	N	00019	02	00	00	01	00	00	00	00	00	00	00	00	00	02	00	N	B	M	 	 	 	 	 	 	 	 	 	0000	0000	6124897208	601179750000162	 	 	 	 	 	07/16/2024	N	   	8035462263	2025-10-03 00:00:00	09/03/2024	Y	Y	 	112589	                         	                         	                                        	09/03/2024	          	000000000000000	N	00	00	Y	      	      	      	            	           	1071101099       	053202208	 	00000000	02/10/2023	2023/02/10	2024/07/16	 	US	KEVIN@MOOREDISTRO.COM                                                   	kevin@mooredistro.com                                                   	N	                                	                 	C	         	0000.00000	N	C	N	N	                                	                 	C	         	000.00000	0000.00000	                                	                 	C	         	000.00000	0000.00000	                                	                 	C	         	000.00000	0000.00000	                                	                 	C	         	000.00000	0000.00000	N	N	N	N	                                                                                                                                                                                                                                                                                                                                                                                  	
6759	800000	800101	675900000009092 	PLANET VAPOR                            	ISO LACE GROUP                          	5999	5999	PLANET VAPOR INC #500    	IRMO         	SC	000029063	0000000000	0000000000	000000000 	0000	0000	6759	0000	472803059	000000000	Y	0000	D	 	 	    	    	    	                	                	0000000000000000	0000000000000000	Y	N	N	N	N	N	N	N	N	N	N	N	N	1000	3	00000000	N	KEVIN MOORE              	                         	                         	                         	553900030	000000000	08/30/2024	02/02/2023	02/02/2023	99/99/9999	99/99/9999	99/99/9999	99/99/9999	N	00019	02	00	00	01	00	00	00	00	00	00	00	00	00	02	00	N	B	M	 	 	 	 	 	 	 	 	 	0000	0000	6124897208	601179750000170	 	 	 	 	 	07/16/2024	N	   	8035462263	2025-10-03 00:00:00	09/03/2024	Y	Y	 	112589	                         	                         	                                        	09/03/2024	          	000000000000000	N	00	00	Y	      	      	      	            	           	1071100734       	053202208	 	00000000	02/10/2023	2023/02/10	2024/07/16	 	US	KEVIN@MOOREDISTRO.COM                                                   	kevin@mooredistro.com                                                   	N	                                	                 	C	         	0000.00000	N	C	N	N	                                	                 	C	         	000.00000	0000.00000	                                	                 	C	         	000.00000	0000.00000	                                	                 	C	         	000.00000	0000.00000	                                	                 	C	         	000.00000	0000.00000	N	N	N	N	                                                                                                                                                                                                                                                                                                                                                                                  	
6759	800000	800101	675900000009951 	PLANET VAPOR                            	ISO LACE GROUP                          	5999	5999	PLANET VAPOR INC #600    	FLORENCE     	SC	000029505	0000000000	0000000000	000000000 	0000	0000	6759	0000	472803059	000000000	Y	0000	D	 	 	    	    	    	                	                	0000000000000000	0000000000000000	Y	N	N	N	N	N	N	N	N	N	N	N	N	1000	3	00000000	N	KEVIN MOORE              	                         	                         	                         	533900030	000000000	09/30/2024	02/02/2023	02/02/2023	99/99/9999	99/99/9999	99/99/9999	99/99/9999	N	00020	02	00	00	01	00	00	00	00	00	00	00	00	00	02	00	N	B	M	 	 	 	 	 	 	 	 	 	0000	0000	6124897208	601179750000188	 	 	 	 	 	08/02/2024	N	   	8035462263	2025-10-03 00:00:00	09/03/2024	Y	Y	 	112589	                         	                         	                                        	09/03/2024	          	000000000000000	N	00	00	Y	      	      	      	            	           	9633959343       	053100300	 	00000000	02/10/2023	2023/02/10	2024/08/02	 	US	KEVIN@MOOREDISTRO.COM                                                   	kevin@mooredistro.com                                                   	N	                                	                 	C	         	0000.00000	N	C	N	N	                                	                 	C	         	000.00000	0000.00000	                                	                 	C	         	000.00000	0000.00000	                                	                 	C	         	000.00000	0000.00000	                                	                 	C	         	000.00000	0000.00000	N	N	N	N	                                                                                                                                                                                                                                                                                                                                                                                  	
6759	800000	800101	675900000010900 	PLANET VAPOR                            	ISO LACE GROUP                          	5999	5999	PLANET VAPOR INC #700    	LUGOFF       	SC	000029078	0000000000	0000000000	000000000 	0000	0000	6759	0000	472803059	000000000	Y	0000	D	 	 	    	    	    	                	                	0000000000000000	0000000000000000	Y	N	N	N	N	N	N	N	N	N	N	N	N	1000	3	00000000	N	KEVIN MOORE              	                         	                         	                         	533900030	000000000	08/30/2024	02/02/2023	02/02/2023	99/99/9999	99/99/9999	99/99/9999	99/99/9999	N	00019	02	00	00	01	00	00	00	00	00	00	00	00	00	02	00	N	B	M	 	 	 	 	 	 	 	 	 	0000	0000	6124897208	601179750000196	 	 	 	 	 	07/19/2024	N	   	8035462263	2025-10-03 00:00:00	09/03/2024	Y	Y	 	112589	                         	                         	                                        	09/03/2024	          	000000000000000	N	00	00	Y	      	      	      	            	           	1071102710       	053202208	 	00000000	02/10/2023	2023/02/10	2024/07/19	 	US	KEVIN@MOOREDISTRO.COM                                                   	kevin@mooredistro.com                                                   	N	                                	                 	C	         	0000.00000	N	C	N	N	                                	                 	C	         	000.00000	0000.00000	                                	                 	C	         	000.00000	0000.00000	                                	                 	C	         	000.00000	0000.00000	                                	                 	C	         	000.00000	0000.00000	N	N	N	N	                                                                                                                                                                                                                                                                                                                                                                                  	
6759	800000	800101	675900000010942 	PLANET VAPOR                            	ISO LACE GROUP                          	5999	5999	PLANET VAPOR INC #800    	WEST COLUMBIA	SC	000029169	0000000000	0000000000	000000000 	0000	0000	6759	0000	472803059	000000000	Y	0000	D	 	 	    	    	    	                	                	0000000000000000	0000000000000000	Y	N	N	N	N	N	N	N	N	N	N	N	N	1000	3	00000000	N	KEVIN MOORE              	                         	                         	                         	533900030	000000000	08/30/2024	02/02/2023	02/02/2023	99/99/9999	99/99/9999	99/99/9999	99/99/9999	N	00019	02	00	00	01	00	00	00	00	00	00	00	00	00	02	00	N	B	M	 	 	 	 	 	 	 	 	 	0000	0000	6124897208	601179750000204	 	 	 	 	 	07/22/2024	N	   	8035462263	2025-10-03 00:00:00	09/03/2024	Y	Y	 	112589	                         	                         	                                        	09/03/2024	          	000000000000000	N	00	00	Y	      	      	      	            	           	1071103180       	053202208	 	00000000	02/10/2023	2023/02/10	2024/07/22	 	US	KEVIN@MOOREDISTRO.COM                                                   	kevin@mooredistro.com                                                   	N	                                	                 	C	         	0000.00000	N	C	N	N	                                	                 	C	         	000.00000	0000.00000	                                	                 	C	         	000.00000	0000.00000	                                	                 	C	         	000.00000	0000.00000	                                	                 	C	         	000.00000	0000.00000	N	N	N	N	                                                                                                                                                                                                                                                                                                                                                                                  	
6759	800000	800101	675900000011072 	PLANET VAPOR                            	ISO LACE GROUP                          	5999	5999	PLANET VAPOR #1000       	WINNSBORO    	SC	000029180	0000000000	0000000000	000000000 	0000	0000	6759	0000	472803059	000000000	Y	0000	D	 	 	    	    	    	                	                	0000000000000000	0000000000000000	Y	N	N	N	N	N	N	N	N	N	N	N	N	1000	3	00000000	N	KEVIN MOORE              	                         	                         	                         	533900030	000000000	08/30/2024	02/02/2023	02/02/2023	99/99/9999	99/99/9999	99/99/9999	99/99/9999	N	00019	02	00	00	01	00	00	00	00	00	00	00	00	00	02	00	N	B	M	 	 	 	 	 	 	 	 	 	0000	0000	6124897208	601179750000212	 	 	 	 	 	07/23/2024	N	   	8035462263	2025-10-03 00:00:00	09/03/2024	Y	Y	 	112589	                         	                         	                                        	09/03/2024	          	000000000000000	N	00	00	Y	      	      	      	            	           	1071103873       	053202208	 	00000000	02/10/2023	2023/02/10	2024/07/23	 	US	KEVIN@MOOREDISTRO.COM                                                   	kevin@mooredistro.com                                                   	N	                                	                 	C	         	0000.00000	N	C	N	N	                                	                 	C	         	000.00000	0000.00000	                                	                 	C	         	000.00000	0000.00000	                                	                 	C	         	000.00000	0000.00000	                                	                 	C	         	000.00000	0000.00000	N	N	N	N	                                                                                                                                                                                                                                                                                                                                                                                  	
6759	800000	800101	675900000011296 	PLANET VAPOR                            	ISO LACE GROUP                          	5999	5999	PLANET VAPOR INC #900    	NORTH AUGUSTA	SC	000029841	0000000000	0000000000	000000000 	0000	0000	6759	0000	472803059	000000000	Y	0000	D	 	 	    	    	    	                	                	0000000000000000	0000000000000000	Y	N	N	N	N	N	N	N	N	N	N	N	N	1000	3	00000000	N	KEVIN MOORE              	                         	                         	                         	533900030	000000000	09/30/2024	02/02/2023	02/02/2023	99/99/9999	99/99/9999	99/99/9999	99/99/9999	N	00020	02	00	00	01	00	00	00	00	00	00	00	00	00	02	00	N	B	M	 	 	 	 	 	 	 	 	 	0000	0000	6124897208	601179750000220	 	 	 	 	 	08/05/2024	N	   	8035462263	2025-10-03 00:00:00	09/03/2024	Y	Y	 	112589	                         	                         	                                        	09/03/2024	          	000000000000000	N	00	00	Y	      	      	      	            	           	9164543299       	053906041	 	00000000	02/10/2023	2023/02/10	2024/08/05	 	US	KEVIN@MOOREDISTRO.COM                                                   	kevin@mooredistro.com                                                   	N	                                	                 	C	         	0000.00000	N	C	N	N	                                	                 	C	         	000.00000	0000.00000	                                	                 	C	         	000.00000	0000.00000	                                	                 	C	         	000.00000	0000.00000	                                	                 	C	         	000.00000	0000.00000	N	N	N	N	                                                                                                                                                                                                                                                                                                                                                                                  	
6759	800000	800888	675900000011650 	K MERCHANTS                             	ISO LACE GROUP                          	5999	5999	VPODS HOLDINGS INC       	CHICAGO      	IL	000060614	7732092463	0000000000	000000000 	0000	0000	6759	0000	883526669	000000000	Y	0000	 	 	 	    	    	    	                	                	0000000000000000	0000000000000000	Y	N	N	N	N	N	N	N	N	N	N	N	N	8000	9	00000000	N	VANESSA PODSADA          	                         	                         	                         	000000000	000000000	09/30/2025	02/09/2023	02/09/2023	99/99/9999	99/99/9999	99/99/9999	99/99/9999	N	00032	02	00	00	01	00	00	00	00	00	00	00	00	00	02	00	N	B	M	 	 	 	 	 	 	 	 	 	0000	0000	          	601179750000238	 	 	 	 	 	10/03/2025	N	   	7736616039	2025-10-03 00:00:00	02/09/2023	Y	N	 	000000	                         	                         	                                        	00/00/0000	          	000000000000000	N	00	00	Y	      	      	      	            	           	902856977        	071000013	 	00000000	02/14/2023	2023/02/14	2025/10/03	 	US	SMOKEDREAMS2@ICLOUD.COM                                                 	Smokedreams2@icloud.com                                                 	N	                                	                 	C	         	0000.00000	N	C	N	N	                                	                 	C	         	000.00000	0000.00000	                                	                 	C	         	000.00000	0000.00000	                                	                 	C	         	000.00000	0000.00000	                                	                 	C	         	000.00000	0000.00000	N	N	N	N	                                                                                                                                                                                                                                                                                                                                                                                  	
6759	800000	800888	675900000012666 	K MERCHANTS                             	ISO LACE GROUP                          	8299	8299	B&L VENTURES             	LAS VEGAS    	NV	000089139	8014044287	0000000000	000000000 	0000	0000	6759	0000	529659708	000000000	Y	0000	D	 	 	    	    	    	                	                	0000000000000000	0000000000000000	Y	N	N	N	N	N	N	N	N	N	N	N	N	8000	9	00000000	N	BRANDON GODFREY          	                         	                         	                         	529659708	000000000	10/31/2023	02/09/2023	02/09/2023	99/99/9999	99/99/9999	99/99/9999	99/99/9999	N	00009	02	00	00	01	00	00	00	00	00	00	00	00	00	02	00	N	B	M	 	 	 	 	 	 	 	 	 	0000	0000	6124897323	601179750000253	 	 	 	 	 	07/16/2023	N	   	7022133534	2025-10-03 00:00:00	11/03/2023	Y	Y	 	112589	                         	                         	                                        	11/03/2023	          	000000000000000	N	00	00	Y	      	      	      	            	           	610501220        	124001545	 	00000000	02/28/2023	2023/02/28	2023/06/08	 	US	SUPPORT@BANDLVENTURES.COM                                               	support@bandlventures.com                                               	N	                                	                 	C	         	0000.00000	N	C	N	N	                                	                 	C	         	000.00000	0000.00000	                                	                 	C	         	000.00000	0000.00000	                                	                 	C	         	000.00000	0000.00000	                                	                 	C	         	000.00000	0000.00000	N	N	N	N	                                                                                                                                                                                                                                                                                                                                                                                  	
6759	800000	800102	675900000013300 	GREENOTTER                              	ISO LACE GROUP                          	5499	5499	CBD8666317293 GOS        	MARIETTA     	GA	000030066	6787614584	0000000000	000000000 	0000	0000	6759	0000	871584967	000000000	Y	0000	D	 	 	    	    	    	                	                	0000000000000000	0000000000000000	Y	N	N	N	N	N	N	N	N	N	N	N	N	8000	9	00000000	N	ERIC MORRIS              	                         	                         	                         	572735043	000000000	10/31/2023	02/15/2023	02/15/2023	99/99/9999	99/99/9999	99/99/9999	99/99/9999	N	00009	00	00	00	01	00	00	00	00	00	00	00	00	00	00	00	N	B	M	 	 	 	 	 	 	 	 	 	0000	0000	6124897208	601179750000261	 	 	 	 	 	10/11/2023	N	   	8666317293	2025-10-03 00:00:00	08/03/2023	Y	Y	 	112589	                         	                         	                                        	08/03/2023	          	000000000000000	N	00	00	Y	      	      	      	            	           	334071313076     	061000052	 	00000000	02/17/2023	2023/02/17	2023/07/18	 	US	EMORRIS@GREENOTTERCBD.COM                                               	emorris@greenottercbd.com                                               	N	                                	                 	C	         	0000.00000	N	C	N	N	                                	                 	C	         	000.00000	0000.00000	                                	                 	C	         	000.00000	0000.00000	                                	                 	C	         	000.00000	0000.00000	                                	                 	C	         	000.00000	0000.00000	N	N	N	N	                                                                                                                                                                                                                                                                                                                                                                                  	
6759	800000	800102	675900000014274 	GREENOTTER                              	ISO LACE GROUP                          	5499	5499	CBD8666317293            	MARIETTA     	GA	000030066	6787614584	0000000000	000000000 	0000	0000	6759	0000	871584967	000000000	Y	0000	D	 	 	    	    	    	                	                	0000000000000000	0000000000000000	Y	N	N	N	N	N	N	N	N	N	N	N	N	8000	9	00000000	N	ERIC MORRIS              	                         	                         	                         	572735043	000000000	02/29/2024	02/15/2023	02/15/2023	01/01/2001	99/99/9999	01/01/2001	01/01/2001	N	00011	00	00	00	01	00	00	00	00	00	00	00	00	00	00	00	N	B	M	 	 	 	 	 	 	 	 	 	0000	0000	6124897208	601179750000279	 	 	 	 	 	02/07/2024	N	   	8666317293	2025-10-03 00:00:00	08/03/2023	Y	Y	 	112589	                         	                         	                                        	08/03/2023	          	000000000000000	N	00	00	Y	      	      	      	            	           	334071313076     	061000052	 	00000000	02/17/2023	2023/02/17	2023/07/17	 	US	                                                                        	                                                                        	N	                                	                 	C	         	0000.00000	N	C	N	N	                                	                 	C	         	000.00000	0000.00000	                                	                 	C	         	000.00000	0000.00000	                                	                 	C	         	000.00000	0000.00000	                                	                 	C	         	000.00000	0000.00000	N	N	N	N	                                                                                                                                                                                                                                                                                                                                                                                  	
6759	800000	800888	675900000014357 	K MERCHANTS                             	ISO LACE GROUP                          	5999	5999	JUST DO IT PROS LLC      	WINTER PARK  	FL	000032792	4078081701	0000000000	000000000 	0000	0000	6759	0000	861234631	000000000	Y	0000	D	 	 	    	    	    	                	                	0000000000000000	0000000000000000	Y	N	N	N	N	N	N	N	N	N	N	N	N	8000	9	00000000	N	TRISTEN MIRANDA          	                         	                         	                         	595750287	000000000	01/31/2024	02/16/2023	02/16/2023	99/99/9999	99/99/9999	99/99/9999	99/99/9999	N	00012	00	00	00	01	00	00	00	00	00	00	00	00	00	00	00	N	B	M	 	 	 	 	 	 	 	 	 	0000	0000	6124897208	601179750000287	 	 	 	 	 	03/10/2023	N	   	3124443528	2025-10-03 00:00:00	02/12/2024	Y	Y	 	112589	                         	                         	                                        	02/12/2024	          	000000000000000	N	00	00	Y	      	      	      	            	           	2000487          	071122205	 	00000000	03/02/2023	2023/03/02	2023/03/10	 	US	FREECANNABISGOODS@GMAIL.COM                                             	freecannabisgoods@gmail.com                                             	N	                                	                 	C	         	0000.00000	N	C	N	N	                                	                 	C	         	000.00000	0000.00000	                                	                 	C	         	000.00000	0000.00000	                                	                 	C	         	000.00000	0000.00000	                                	                 	C	         	000.00000	0000.00000	N	N	N	N	                                                                                                                                                                                                                                                                                                                                                                                  	
6759	800000	800888	675900000014522 	K MERCHANTS                             	ISO LACE GROUP                          	5499	5499	RIP STRIPS LLC           	LIVONIA      	MI	000048152	2144972076	0000000000	000000000 	0000	0000	6759	0000	921936836	000000000	Y	0000	D	 	 	    	    	    	                	                	0000000000000000	0000000000000000	Y	N	N	N	N	N	N	N	N	N	N	N	N	8000	9	00000000	N	CHARLES ARCHAMBEAU       	                         	                         	                         	378043762	000000000	05/31/2024	02/17/2023	02/17/2023	99/99/9999	99/99/9999	99/99/9999	99/99/9999	N	00016	00	00	00	01	00	00	00	00	00	00	00	00	00	00	00	N	B	M	 	 	 	 	 	 	 	 	 	0000	0000	6124897208	601179750000295	 	 	 	 	 	01/04/2024	N	   	2144972076	2025-10-03 00:00:00	06/21/2024	Y	Y	 	112589	                         	                         	                                        	06/21/2024	          	000000000000000	N	00	00	Y	      	      	      	            	           	2000461          	071122205	 	00000000	04/23/2023	2023/02/23	2024/01/04	 	US	SALES@RIPSTRIPS.COM                                                     	sales@ripstrips.com                                                     	N	                                	                 	C	         	0000.00000	N	C	N	N	                                	                 	C	         	000.00000	0000.00000	                                	                 	C	         	000.00000	0000.00000	                                	                 	C	         	000.00000	0000.00000	                                	                 	C	         	000.00000	0000.00000	N	N	N	N	                                                                                                                                                                                                                                                                                                                                                                                  	
6759	800000	800108	675900000014787 	SOUTH PAW PRINTZ                        	ISO LACE GROUP                          	5699	5699	SOUTH PAW PRINTZ LLC     	LEXINGTON    	SC	000029072	8035462263	0000000000	000000000 	0000	0000	6759	0000	862597249	000000000	Y	0000	D	 	 	    	    	    	                	                	0000000000000000	0000000000000000	Y	N	N	N	N	N	N	N	N	N	N	N	N	8000	9	00000000	N	KEVIN MOORE              	                         	                         	                         	533900030	000000000	09/30/2024	02/22/2023	02/22/2023	99/99/9999	99/99/9999	99/99/9999	99/99/9999	N	00020	00	00	00	01	00	00	00	00	00	00	00	00	00	00	00	N	B	M	 	 	 	 	 	 	 	 	 	0000	0000	6124897208	601179750000303	 	 	 	 	 	07/25/2024	N	   	8033819859	2025-10-03 00:00:00	09/30/2024	Y	Y	 	112589	                         	                         	                                        	09/30/2024	          	000000000000000	N	00	00	Y	      	      	      	            	           	1110006890       	053202208	 	00000000	04/24/2023	2023/04/06	2024/07/25	 	US	INFO@SOUTHPAWPRINTZ.COM                                                 	info@southpawprintz.com                                                 	N	                                	                 	C	         	0000.00000	N	C	N	N	                                	                 	C	         	000.00000	0000.00000	                                	                 	C	         	000.00000	0000.00000	                                	                 	C	         	000.00000	0000.00000	                                	                 	C	         	000.00000	0000.00000	N	N	N	N	                                                                                                                                                                                                                                                                                                                                                                                  	
6759	800000	800888	675900000015164 	K MERCHANTS                             	ISO LACE GROUP                          	5999	5999	GOLDAXA LLC              	LEHI         	UT	000084043	8014041097	0000000000	000000000 	0000	0000	6759	0000	884295529	000000000	Y	0000	D	 	 	    	    	    	                	                	0000000000000000	0000000000000000	Y	N	N	N	N	N	N	N	N	N	N	N	N	8000	9	00000000	N	NEIL WARR                	                         	                         	                         	538216459	000000000	01/31/2024	03/01/2023	03/01/2023	99/99/9999	99/99/9999	99/99/9999	99/99/9999	N	00011	00	00	00	01	00	00	00	00	00	00	00	00	00	00	00	N	B	M	 	 	 	 	 	 	 	 	 	0000	0000	6124897208	601179750000311	 	 	 	 	 	11/21/2023	N	   	8014041097	2025-10-03 00:00:00	02/26/2024	Y	Y	 	112589	                         	                         	                                        	02/26/2024	          	000000000000000	N	00	00	Y	      	      	      	            	           	917961069        	124001545	 	00000000	03/02/2023	2023/03/02	2023/07/25	 	US	NEIL@GOLDAXAPRODUCTS.COM                                                	neil@goldaxaproducts.com                                                	N	                                	                 	C	         	0000.00000	N	C	N	N	                                	                 	C	         	000.00000	0000.00000	                                	                 	C	         	000.00000	0000.00000	                                	                 	C	         	000.00000	0000.00000	                                	                 	C	         	000.00000	0000.00000	N	N	N	N	                                                                                                                                                                                                                                                                                                                                                                                  	
6759	800000	800103	675900000015636 	CAROLINA BEST                           	ISO LACE GROUP                          	5499	5499	CAROLINA BEST DIST LLC   	ASHEVILLE    	NC	000028801	8282303660	0000000000	000000000 	0000	0000	6759	0000	832726306	000000000	Y	0000	D	 	 	    	    	    	                	                	0000000000000000	0000000000000000	Y	N	N	N	N	N	N	N	N	N	N	N	N	8000	9	00000000	N	JAMES GALLAGHER          	                         	                         	                         	013602065	000000000	08/30/2024	03/02/2023	03/06/2023	99/99/9999	99/99/9999	99/99/9999	99/99/9999	N	00018	00	00	00	01	00	00	00	00	00	00	00	00	00	00	00	N	B	M	 	 	 	 	 	 	 	 	 	0000	0000	6124897208	601179750000329	 	 	 	 	 	03/13/2023	N	   	8282303660	2025-10-03 00:00:00	09/30/2024	Y	Y	 	112589	                         	                         	                                        	09/30/2024	          	000000000000000	N	00	00	Y	      	      	      	            	           	1000210527908    	053100465	 	00000000	          	2023/03/13	2023/03/13	 	US	CAROLINABESTDISTRIBUTION@GMAIL.COM                                      	carolinabestdistribution@gmail.com                                      	N	                                	                 	C	         	0000.00000	N	C	N	N	                                	                 	C	         	000.00000	0000.00000	                                	                 	C	         	000.00000	0000.00000	                                	                 	C	         	000.00000	0000.00000	                                	                 	C	         	000.00000	0000.00000	N	N	N	N	                                                                                                                                                                                                                                                                                                                                                                                  	
6759	800000	800102	675900000016196 	GREENOTTER                              	ISO LACE GROUP                          	5499	5499	CBD8666317293 GS2        	MARIETTA     	GA	000030066	6787614584	0000000000	000000000 	0000	0000	6759	0000	871584967	000000000	Y	0000	D	 	 	    	    	    	                	                	0000000000000000	0000000000000000	Y	N	N	N	N	N	N	N	N	N	N	N	N	8000	9	00000000	N	ERIC MORRIS              	                         	                         	                         	572735043	000000000	02/29/2024	03/09/2023	03/09/2023	99/99/9999	99/99/9999	99/99/9999	99/99/9999	N	00009	00	00	00	01	00	00	00	00	00	00	00	00	00	00	00	N	B	M	 	 	 	 	 	 	 	 	 	0000	0000	6124897208	601179750000337	 	 	 	 	 	02/07/2024	N	   	8666317293	2025-10-03 00:00:00	08/03/2023	Y	Y	 	112589	                         	                         	                                        	08/03/2023	          	000000000000000	N	00	00	Y	      	      	      	            	           	334071313076     	061000052	 	00000000	04/13/2023	2023/04/12	2023/07/17	 	US	EMORRIS@GREENOTTERCBD.COM                                               	emorris@greenottercbd.com                                               	N	                                	                 	C	         	0000.00000	N	C	N	N	                                	                 	C	         	000.00000	0000.00000	                                	                 	C	         	000.00000	0000.00000	                                	                 	C	         	000.00000	0000.00000	                                	                 	C	         	000.00000	0000.00000	N	N	N	N	                                                                                                                                                                                                                                                                                                                                                                                  	
6759	800000	800104	675900000016865 	EAST COAST LIQUIDS                      	ISO LACE GROUP                          	5499	5499	EAST COAST LIQUIDS LLC   	COLUMBIA     	SC	000029201	8035462263	0000000000	000000000 	0000	0000	6759	0000	474549822	000000000	Y	0000	D	 	 	    	    	    	                	                	0000000000000000	0000000000000000	Y	N	N	N	N	N	N	N	N	N	N	N	N	8000	9	00000000	N	KEVIN MOORE              	                         	                         	                         	533900030	000000000	09/30/2024	03/09/2023	03/09/2023	99/99/9999	99/99/9999	99/99/9999	99/99/9999	N	00018	00	00	00	01	00	00	00	00	00	00	00	00	00	00	00	N	B	M	 	 	 	 	 	 	 	 	 	0000	0000	6124897208	601179750000345	 	 	 	 	 	08/21/2024	N	   	8038514198	2025-10-03 00:00:00	09/03/2024	Y	Y	 	112589	                         	                         	                                        	09/03/2024	          	000000000000000	N	00	00	Y	      	      	      	            	           	1071100394       	053202208	 	00000000	03/21/2023	2023/03/21	2024/08/21	 	US	KEVIN@MOOREDISTRO.COM                                                   	kevin@mooredistro.com                                                   	N	                                	                 	C	         	0000.00000	N	C	N	N	                                	                 	C	         	000.00000	0000.00000	                                	                 	C	         	000.00000	0000.00000	                                	                 	C	         	000.00000	0000.00000	                                	                 	C	         	000.00000	0000.00000	N	N	N	N	                                                                                                                                                                                                                                                                                                                                                                                  	
6759	800000	800106	675900000017673 	VANGUARD TRADERS                        	ISO LACE GROUP                          	5499	5499	VANGUARD TRADERS LLC     	NEWPORT BEACH	CA	000092660	8586251175	0000000000	000000000 	0000	0000	6759	0000	874216704	000000000	Y	0000	D	 	 	    	    	    	                	                	0000000000000000	0000000000000000	Y	N	N	N	N	N	N	N	N	N	N	N	N	8000	9	00000000	N	JAMES GREEN              	                         	                         	                         	378921734	000000000	10/31/2023	03/09/2023	03/09/2023	99/99/9999	99/99/9999	99/99/9999	99/99/9999	N	00007	00	00	00	01	00	00	00	00	00	00	00	00	00	00	00	N	B	M	 	 	 	 	 	 	 	 	 	0000	0000	6124897208	601179750000352	 	 	 	 	 	10/20/2023	N	   	8442535693	2025-10-03 00:00:00	08/03/2023	Y	Y	 	112589	                         	                         	                                        	08/03/2023	          	000000000000000	N	00	00	Y	      	      	      	            	           	107068934        	103013017	 	00000000	03/13/2023	2023/03/13	2023/07/04	 	US	MR.JIMHGREEN@GMAIL.COM                                                  	mr.jimhgreen@gmail.com                                                  	N	                                	                 	C	         	0000.00000	N	C	N	N	                                	                 	C	         	000.00000	0000.00000	                                	                 	C	         	000.00000	0000.00000	                                	                 	C	         	000.00000	0000.00000	                                	                 	C	         	000.00000	0000.00000	N	N	N	N	                                                                                                                                                                                                                                                                                                                                                                                  	
6759	800000	800105	675900000018572 	GALLERY SMOKE                           	ISO LACE GROUP                          	5999	5999	GALLERY SMOKE SHOP LLC   	SEMINOLE     	FL	000033777	7724522461	0000000000	000000000 	0000	0000	6759	0000	851949815	000000000	Y	0000	 	 	 	    	    	    	                	                	0000000000000000	0000000000000000	Y	N	N	N	N	N	N	N	N	N	N	N	N	8000	9	00000000	N	BROOKS PALMER            	                         	                         	                         	568856928	000000000	09/30/2025	03/09/2023	03/09/2023	99/99/9999	99/99/9999	99/99/9999	99/99/9999	N	00031	02	00	00	01	00	00	00	00	00	00	00	00	00	02	00	N	B	M	 	 	 	 	 	 	 	 	 	0000	0000	          	601179750000360	 	 	 	 	 	10/03/2025	N	   	7279546318	2025-10-03 00:00:00	03/09/2023	Y	N	 	000000	                         	                         	                                        	00/00/0000	          	000000000000000	N	00	00	Y	      	      	      	            	           	1534934862       	063107513	 	00000000	03/13/2023	2023/03/13	2025/10/03	 	US	INFO@GALLERYSMOKESHOP.COM                                               	info@gallerysmokeshop.com                                               	N	                                	                 	C	         	0000.00000	N	C	N	N	                                	                 	C	         	000.00000	0000.00000	                                	                 	C	         	000.00000	0000.00000	                                	                 	C	         	000.00000	0000.00000	                                	                 	C	         	000.00000	0000.00000	N	N	N	N	                                                                                                                                                                                                                                                                                                                                                                                  	
6759	800000	800101	675900000019562 	PLANET VAPOR                            	ISO LACE GROUP                          	5999	5999	PLANET VAPOR #1100       	BLYTHEWOOD   	SC	000029016	8035462263	0000000000	000000000 	0000	0000	6759	0000	472803059	000000000	Y	0000	D	 	 	    	    	    	                	                	0000000000000000	0000000000000000	Y	N	N	N	N	N	N	N	N	N	N	N	N	1000	3	00000000	N	KEVIN MOORE              	                         	                         	                         	533900030	000000000	08/30/2024	03/10/2023	03/10/2023	99/99/9999	99/99/9999	99/99/9999	99/99/9999	N	00018	02	00	00	01	00	00	00	00	00	00	00	00	00	02	00	N	B	M	 	 	 	 	 	 	 	 	 	0000	0000	6124897208	601179750000378	 	 	 	 	 	07/17/2024	N	   	8038511418	2025-10-03 00:00:00	09/03/2024	Y	Y	 	112589	                         	                         	                                        	09/03/2024	          	000000000000000	N	00	00	Y	      	      	      	            	           	1071104004       	053202208	 	00000000	03/30/2023	2023/03/29	2024/07/17	 	US	KEVIN@MOOREDISTRO.COM                                                   	kevin@mooredistro.com                                                   	N	                                	                 	C	         	0000.00000	N	C	N	N	                                	                 	C	         	000.00000	0000.00000	                                	                 	C	         	000.00000	0000.00000	                                	                 	C	         	000.00000	0000.00000	                                	                 	C	         	000.00000	0000.00000	N	N	N	N	                                                                                                                                                                                                                                                                                                                                                                                  	
6759	800000	800109	675900000019828 	GOLDAXA                                 	ISO LACE GROUP                          	5999	5999	GOLDAXA LLC              	LEHI         	UT	000084043	8014041097	0000000000	000000000 	0000	0000	6759	0000	884295529	000000000	Y	0000	D	 	 	    	    	    	                	                	0000000000000000	0000000000000000	Y	N	N	N	N	N	N	N	N	N	N	N	N	8000	9	00000000	N	NEIL WARR                	                         	                         	                         	538216459	000000000	01/31/2024	03/17/2023	03/17/2023	99/99/9999	99/99/9999	99/99/9999	99/99/9999	N	00011	00	00	00	01	00	00	00	00	00	00	00	00	00	00	00	N	B	M	 	 	 	 	 	 	 	 	 	0000	0000	6124897208	601179750000394	 	 	 	 	 	11/17/2023	N	   	8885968154	2025-10-03 00:00:00	02/26/2024	Y	Y	 	112589	                         	                         	                                        	02/26/2024	          	000000000000000	N	00	00	Y	      	      	      	            	           	917961069        	124001545	 	00000000	03/21/2023	2023/03/21	2023/08/04	 	US	NEIL@GOLDAXAPRODUCTS.COM                                                	neil@goldaxaproducts.com                                                	N	                                	                 	C	         	0000.00000	N	C	N	N	                                	                 	C	         	000.00000	0000.00000	                                	                 	C	         	000.00000	0000.00000	                                	                 	C	         	000.00000	0000.00000	                                	                 	C	         	000.00000	0000.00000	N	N	N	N	                                                                                                                                                                                                                                                                                                                                                                                  	
6759	800000	800110	675900000020099 	GALAXY GAS                              	ISO LACE GROUP                          	5999	5999	GALAXY GAS LLC           	KENNESAW     	GA	000030144	4044777965	0000000000	000000000 	0000	0000	6759	0000	873873876	000000000	Y	0000	D	 	 	    	    	    	                	                	0000000000000000	0000000000000000	Y	N	N	N	N	N	N	N	N	N	N	N	N	8000	9	00000000	N	SAMMY AMOR               	                         	                         	                         	064846745	000000000	04/30/2023	03/20/2023	03/20/2023	99/99/9999	99/99/9999	99/99/9999	99/99/9999	N	00001	00	00	00	01	00	00	00	00	00	00	00	00	00	00	00	N	B	M	 	 	 	 	 	 	 	 	 	0000	0000	6124897208	601179750000402	 	 	 	 	 	04/23/2023	N	   	4044777965	2025-10-03 00:00:00	11/09/2023	Y	Y	 	112589	                         	                         	                                        	05/01/2023	          	000000000000000	N	00	00	Y	      	      	      	            	           	334070069851     	061000052	 	00000000	          	2023/04/23	2023/04/23	 	US	ACCOUNTING@SBKINT.COM                                                   	accounting@sbkint.com                                                   	N	                                	                 	C	         	0000.00000	N	C	N	N	                                	                 	C	         	000.00000	0000.00000	                                	                 	C	         	000.00000	0000.00000	                                	                 	C	         	000.00000	0000.00000	                                	                 	C	         	000.00000	0000.00000	N	N	N	N	                                                                                                                                                                                                                                                                                                                                                                                  	
6759	800000	800112	675900000020925 	JK DISTRIBUTION                         	ISO LACE GROUP                          	5499	5499	J K DISTRIBUTION INC     	WALLINGFORD  	CT	000006492	8608957639	0000000000	000000000 	0000	0000	6759	0000	850871923	000000000	Y	0000	D	 	 	    	    	    	                	                	0000000000000000	0000000000000000	Y	N	N	N	N	N	N	N	N	N	N	N	N	1000	3	00000000	N	KEVIN RUYS               	                         	                         	                         	049929582	000000000	04/30/2025	03/29/2023	03/29/2023	99/99/9999	99/99/9999	99/99/9999	99/99/9999	N	00026	00	00	00	01	00	00	00	00	00	00	00	00	00	00	00	N	B	M	 	 	 	 	 	 	 	 	 	0000	0000	6124897208	601179750000428	 	 	 	 	 	04/07/2025	N	   	2038159817	2025-10-03 00:00:00	05/07/2025	Y	Y	 	112589	                         	                         	                                        	05/07/2025	          	000000000000000	N	00	00	Y	      	      	      	            	           	2000503          	071122205	 	00000000	03/30/2023	2023/03/30	2025/04/07	 	US	ADMIN@GOODDISTRO.COM                                                    	admin@gooddistro.com                                                    	N	                                	                 	C	         	0000.00000	N	C	N	N	                                	                 	C	         	000.00000	0000.00000	                                	                 	C	         	000.00000	0000.00000	                                	                 	C	         	000.00000	0000.00000	                                	                 	C	         	000.00000	0000.00000	N	N	N	N	                                                                                                                                                                                                                                                                                                                                                                                  	
6759	800000	801113	675900000021485 	FEDERAL CONTRACTING CENTER              	ISO LACE GROUP                          	7392	7392	FED CONTRACTING CTR INC  	CLEARWATER   	FL	000033760	8557005143	0000000000	000000000 	0000	0000	6759	0000	871304360	000000000	Y	0000	D	 	 	    	    	    	                	                	0000000000000000	0000000000000000	Y	N	N	N	N	N	N	N	N	N	N	N	N	1000	3	00000000	N	MICHAEL MAJOR            	                         	                         	                         	590121363	000000000	02/28/2025	03/29/2023	03/29/2023	99/99/9999	99/99/9999	99/99/9999	99/99/9999	N	00024	00	00	00	01	00	00	00	00	00	00	00	00	00	00	00	N	B	M	 	 	 	 	 	 	 	 	 	0000	0000	6124897273	601179750000436	 	 	 	 	 	02/05/2025	N	   	8557005143	2025-10-03 00:00:00	01/14/2025	Y	Y	 	112589	                         	                         	                                        	01/14/2025	          	000000000000000	N	00	00	Y	      	      	      	            	           	4407028392       	067014822	 	00000000	07/20/2023	2023/07/16	2024/09/13	 	US	MIKE@FEDERALCONTRACTINGCENTER.COM                                       	mike@federalcontractingcenter.com                                       	N	                                	                 	C	         	0000.00000	N	C	N	N	                                	                 	C	         	000.00000	0000.00000	                                	                 	C	         	000.00000	0000.00000	                                	                 	C	         	000.00000	0000.00000	                                	                 	C	         	000.00000	0000.00000	N	N	N	N	                                                                                                                                                                                                                                                                                                                                                                                  	
6759	800000	801115	675900000022293 	HIGHER FLOUR LLC                        	ISO LACE GROUP                          	5499	5499	HIGHER FLOUR             	WESLEY CHAPEL	FL	000033544	3134444373	0000000000	000000000 	0000	0000	6759	0000	863838817	000000000	Y	0000	D	 	 	    	    	    	                	                	0000000000000000	0000000000000000	Y	N	N	N	N	N	N	N	N	N	N	N	N	8000	9	00000000	N	BROOKE WAHLQUIST         	                         	                         	                         	591974063	000000000	09/30/2024	03/30/2023	03/30/2023	99/99/9999	99/99/9999	99/99/9999	99/99/9999	N	00019	00	00	00	01	00	00	00	00	00	00	00	00	00	00	00	N	B	M	 	 	 	 	 	 	 	 	 	0000	0000	6124897208	601179750000444	 	 	 	 	 	04/13/2023	N	   	3134444373	2025-10-03 00:00:00	10/02/2024	Y	Y	 	112589	                         	                         	                                        	10/02/2024	          	000000000000000	N	00	00	Y	      	      	      	            	           	2000321          	071122205	 	00000000	04/13/2023	2023/04/13	2023/04/13	 	US	HIGHERFLOURLLC@GMAIL.COM                                                	higherflourllc@gmail.com                                                	N	                                	                 	C	         	0000.00000	N	C	N	N	                                	                 	C	         	000.00000	0000.00000	                                	                 	C	         	000.00000	0000.00000	                                	                 	C	         	000.00000	0000.00000	                                	                 	C	         	000.00000	0000.00000	N	N	N	N	                                                                                                                                                                                                                                                                                                                                                                                  	
6759	800000	800116	675900000023259 	GROUND FORCE MARKETING                  	ISO LACE GROUP                          	5499	5499	GROUND FORCE MARKETING   	ARCADIA      	CA	000091006	7205802231	0000000000	000000000 	0000	0000	6759	0000	872837729	000000000	Y	0000	D	 	 	    	    	    	                	                	0000000000000000	0000000000000000	Y	N	N	N	N	N	N	N	N	N	N	N	N	8000	9	00000000	N	BRENDA HARDING           	                         	                         	                         	539802213	000000000	09/29/2023	03/31/2023	03/31/2023	99/99/9999	99/99/9999	99/99/9999	99/99/9999	N	00007	00	00	00	01	00	00	00	00	00	00	00	00	00	00	00	N	B	M	 	 	 	 	 	 	 	 	 	0000	0000	6124897208	601179750000469	 	 	 	 	 	09/10/2023	N	   	8442589322	2025-10-03 00:00:00	08/03/2023	Y	Y	 	112589	                         	                         	                                        	08/03/2023	          	000000000000000	N	00	00	Y	      	      	      	            	           	107081515        	103013017	 	00000000	04/03/2023	2023/04/03	2023/07/06	 	US	GROUNDFORCEMARKETING@OUTLOOK.COM                                        	groundforcemarketing@outlook.com                                        	N	                                	                 	C	         	0000.00000	N	C	N	N	                                	                 	C	         	000.00000	0000.00000	                                	                 	C	         	000.00000	0000.00000	                                	                 	C	         	000.00000	0000.00000	                                	                 	C	         	000.00000	0000.00000	N	N	N	N	                                                                                                                                                                                                                                                                                                                                                                                  	
6759	800000	800117	675900000023382 	DELTAS HEALTH LLC                       	ISO LACE GROUP                          	5499	5499	DELTAS HEALTH LLC        	ST PETERSBURG	FL	000033702	7276435361	0000000000	000000000 	0000	0000	6759	0000	853773867	000000000	Y	0000	 	 	 	    	    	    	                	                	0000000000000000	0000000000000000	Y	N	N	N	N	N	N	N	N	N	N	N	N	8000	9	00000000	N	ALBERT LAVALLEY          	                         	                         	                         	592400215	000000000	09/30/2025	04/03/2023	04/03/2023	99/99/9999	99/99/9999	99/99/9999	99/99/9999	N	00030	00	00	00	01	00	00	00	00	00	00	00	00	00	00	00	N	B	M	 	 	 	 	 	 	 	 	 	0000	0000	          	601179750000477	 	 	 	 	 	07/04/2024	N	   	8882784204	2025-10-03 00:00:00	04/03/2023	Y	N	 	000000	                         	                         	                                        	00/00/0000	          	000000000000000	N	00	00	Y	      	      	      	            	           	2000511          	071122205	 	00000000	05/16/2023	2023/04/17	2024/07/04	 	US	KUSHDISPENSARYCO@GMAIL.COM                                              	kushdispensaryco@gmail.com                                              	N	                                	                 	C	         	0000.00000	N	C	N	N	                                	                 	C	         	000.00000	0000.00000	                                	                 	C	         	000.00000	0000.00000	                                	                 	C	         	000.00000	0000.00000	                                	                 	C	         	000.00000	0000.00000	N	N	N	N	                                                                                                                                                                                                                                                                                                                                                                                  	
6759	800000	800119	675900000023606 	HEALTH HALL MEDIA LLC                   	ISO LACE GROUP                          	5499	5499	HEALTH HALL MEDIA LLC    	IRVINE       	CA	000092612	7208204625	0000000000	000000000 	0000	0000	6759	0000	881030995	000000000	Y	0000	D	 	 	    	    	    	                	                	0000000000000000	0000000000000000	Y	N	N	N	N	N	N	N	N	N	N	N	N	8000	9	00000000	N	ALEXANDER HALL           	                         	                         	                         	172723678	000000000	02/29/2024	04/05/2023	04/05/2023	99/99/9999	99/99/9999	99/99/9999	99/99/9999	N	00011	00	00	00	01	00	00	00	00	00	00	00	00	00	00	00	N	B	M	 	 	 	 	 	 	 	 	 	0000	0000	6124897208	601179750000485	 	 	 	 	 	06/19/2023	N	   	8442535693	2025-10-03 00:00:00	03/27/2024	Y	Y	 	112589	                         	                         	                                        	03/27/2024	          	000000000000000	N	00	00	Y	      	      	      	            	           	325166834565     	121000358	 	00000000	04/19/2023	2023/04/07	2023/06/19	 	US	HEALTHHALLMEDIA@GMAIL.COM                                               	healthhallmedia@gmail.com                                               	N	                                	                 	C	         	0000.00000	N	C	N	N	                                	                 	C	         	000.00000	0000.00000	                                	                 	C	         	000.00000	0000.00000	                                	                 	C	         	000.00000	0000.00000	                                	                 	C	         	000.00000	0000.00000	N	N	N	N	                                                                                                                                                                                                                                                                                                                                                                                  	
6759	800000	800120	675900000023911 	VITA FUEL LLC                           	ISO LACE GROUP                          	5999	5999	8442835587VITASUREMEDICAL	NEWPORT BEACH	CA	000092660	8586251175	0000000000	000000000 	0000	0000	6759	0000	870727029	000000000	Y	0000	D	 	 	    	    	    	                	                	0000000000000000	0000000000000000	Y	N	N	N	N	N	N	N	N	N	N	N	N	8000	9	00000000	N	JAMES GREEN              	                         	                         	                         	378921734	000000000	07/31/2023	04/05/2023	04/05/2023	99/99/9999	99/99/9999	99/99/9999	99/99/9999	N	00004	00	00	00	01	00	00	00	00	00	00	00	00	00	00	00	N	B	M	 	 	 	 	 	 	 	 	 	0000	0000	6124897208	601179750000493	 	 	 	 	 	07/26/2023	N	   	8442835587	2025-10-03 00:00:00	08/03/2023	Y	Y	 	112589	                         	                         	                                        	08/03/2023	          	000000000000000	N	00	00	Y	      	      	      	            	           	325168251706     	121000358	 	00000000	04/07/2023	2023/04/07	2023/07/04	 	US	VITAFUELLLC@GMAIL.COM                                                   	vitafuelllc@gmail.com                                                   	N	                                	                 	C	         	0000.00000	N	C	N	N	                                	                 	C	         	000.00000	0000.00000	                                	                 	C	         	000.00000	0000.00000	                                	                 	C	         	000.00000	0000.00000	                                	                 	C	         	000.00000	0000.00000	N	N	N	N	                                                                                                                                                                                                                                                                                                                                                                                  	
6759	800000	800121	675900000024307 	THE APOTHECARY                          	ISO LACE GROUP                          	5499	5499	THE APOTHECARY LLC       	SWANSEA      	MA	000002777	7743016135	0000000000	000000000 	0000	0000	6759	0000	920659951	000000000	Y	0000	 	 	 	    	    	    	                	                	0000000000000000	0000000000000000	Y	N	N	N	N	N	N	N	N	N	N	N	N	8000	9	00000000	N	DEREK WILCOX             	                         	                         	                         	036606728	000000000	09/30/2025	04/06/2023	04/07/2023	99/99/9999	99/99/9999	99/99/9999	99/99/9999	N	00030	00	00	00	01	00	00	00	00	00	00	00	00	00	00	00	N	B	M	 	 	 	 	 	 	 	 	 	0000	0000	4203458096	601179750000501	 	 	 	 	 	10/03/2025	N	   	7743016135	2025-10-03 00:00:00	04/07/2023	Y	N	 	000000	                         	                         	                                        	00/00/0000	          	000000000000000	N	00	00	Y	      	      	      	            	           	2000529          	071122205	 	00000000	04/21/2023	2023/04/21	2025/10/03	 	US	INFO@MASSAPOTHECARY.COM                                                 	info@massapothecary.com                                                 	N	                                	                 	C	         	0000.00000	N	C	N	N	                                	                 	C	         	000.00000	0000.00000	                                	                 	C	         	000.00000	0000.00000	                                	                 	C	         	000.00000	0000.00000	                                	                 	C	         	000.00000	0000.00000	N	N	N	N	                                                                                                                                                                                                                                                                                                                                                                                  	
6759	800000	800122	675900000024794 	EARTH LIFE LLC                          	ISO LACE GROUP                          	5999	5999	EARTH LIFE LLC           	MIAMI        	FL	000033166	7867028785	0000000000	000000000 	0000	0000	6759	0000	881019744	000000000	Y	0000	D	 	 	    	    	    	                	                	0000000000000000	0000000000000000	Y	N	N	N	N	N	N	N	N	N	N	N	N	8000	9	00000000	N	JULIO CRUZ               	                         	                         	                         	267858057	000000000	07/31/2024	04/12/2023	04/12/2023	99/99/9999	99/99/9999	99/99/9999	99/99/9999	N	00016	00	00	00	01	00	00	00	00	00	00	00	00	00	00	00	N	B	M	 	 	 	 	 	 	 	 	 	0000	0000	6124897208	601179750000519	 	 	 	 	 	06/07/2024	N	   	7867928785	2025-10-03 00:00:00	08/01/2024	Y	Y	 	112589	                         	                         	                                        	08/01/2024	          	000000000000000	N	00	00	Y	      	      	      	            	           	4410865252       	067014822	 	00000000	04/14/2023	2023/04/13	2024/03/04	 	US	J@EARTHLIFE4EVER.COM                                                    	J@earthlife4ever.com                                                    	N	                                	                 	C	         	0000.00000	N	C	N	N	                                	                 	C	         	000.00000	0000.00000	                                	                 	C	         	000.00000	0000.00000	                                	                 	C	         	000.00000	0000.00000	                                	                 	C	         	000.00000	0000.00000	N	N	N	N	                                                                                                                                                                                                                                                                                                                                                                                  	
6759	800000	800123	675900000025361 	CBD HEALTH AND SMOKE SHOP               	ISO LACE GROUP                          	5999	5999	CBD HEALTH AND SMOKE SHOP	MARIETTA     	GA	000030066	9739107777	0000000000	000000000 	0000	0000	6759	0000	874572091	000000000	Y	0000	D	 	 	    	    	    	                	                	0000000000000000	0000000000000000	Y	N	N	N	N	N	N	N	N	N	N	N	N	8000	9	00000000	N	TALAT JUDAH              	                         	                         	                         	142821656	000000000	12/31/2023	04/18/2023	04/18/2023	99/99/9999	99/99/9999	99/99/9999	99/99/9999	N	00008	00	00	00	01	00	00	00	00	00	00	00	00	00	00	00	N	B	M	 	 	 	 	 	 	 	 	 	0000	0000	6124897208	601179750000527	 	 	 	 	 	11/30/2023	N	   	6785058480	2025-10-03 00:00:00	12/08/2023	Y	Y	 	112589	                         	                         	                                        	12/08/2023	          	000000000000000	N	00	00	Y	      	      	      	            	           	334061953063     	061000052	 	00000000	04/20/2023	2023/04/20	2023/11/16	 	US	BUYRITEACC@GMAIL.COM                                                    	Buyriteacc@gmail.com                                                    	N	                                	                 	C	         	0000.00000	N	C	N	N	                                	                 	C	         	000.00000	0000.00000	                                	                 	C	         	000.00000	0000.00000	                                	                 	C	         	000.00000	0000.00000	                                	                 	C	         	000.00000	0000.00000	N	N	N	N	                                                                                                                                                                                                                                                                                                                                                                                  	
6759	800000	800124	675900000026047 	HPPYC LLC                               	ISO LACE GROUP                          	5999	5999	THE HAPPY CAMPER         	CHARLOTTE    	NC	000028204	9802368861	0000000000	000000000 	0000	0000	6759	0000	880856097	000000000	Y	0000	 	 	 	    	    	    	                	                	0000000000000000	0000000000000000	Y	N	N	N	N	N	N	N	N	N	N	N	N	8000	9	00000000	N	MICHAEL ANGELICOLA       	                         	                         	                         	246776158	000000000	09/30/2025	04/19/2023	04/19/2023	99/99/9999	99/99/9999	99/99/9999	99/99/9999	N	00030	00	00	00	01	00	00	00	00	00	00	00	00	00	00	00	N	B	M	 	 	 	 	 	 	 	 	 	0000	0000	          	601179750000535	 	 	 	 	 	10/03/2025	N	   	9802368861	2025-10-03 00:00:00	04/19/2023	Y	N	 	000000	                         	                         	                                        	00/00/0000	          	000000000000000	N	00	00	Y	      	      	      	            	           	1340017898735    	053101121	 	00000000	04/20/2023	2023/04/20	2025/10/03	 	US	TORI@SMOKEMFG.COM                                                       	tori@smokemfg.com                                                       	N	                                	                 	C	         	0000.00000	N	C	N	N	                                	                 	C	         	000.00000	0000.00000	                                	                 	C	         	000.00000	0000.00000	                                	                 	C	         	000.00000	0000.00000	                                	                 	C	         	000.00000	0000.00000	N	N	N	N	                                                                                                                                                                                                                                                                                                                                                                                  	
6759	800000	800125	675900000026849 	SHORTINO HOLDINGS LLC                   	ISO LACE GROUP                          	5999	5999	CBD8885133385            	SHERIDAN     	WY	000082801	8014251660	0000000000	000000000 	0000	0000	6759	0000	922897448	000000000	Y	0000	D	 	 	    	    	    	                	                	0000000000000000	0000000000000000	Y	N	N	N	N	N	N	N	N	N	N	N	N	8000	9	00000000	N	JOSEPH SHORTINO          	                         	                         	                         	529644836	000000000	02/29/2024	04/19/2023	04/19/2023	99/99/9999	99/99/9999	99/99/9999	99/99/9999	N	00011	00	00	00	01	00	00	00	00	00	00	00	00	00	00	00	N	B	M	 	 	 	 	 	 	 	 	 	0000	0000	6124897208	601179750000543	 	 	 	 	 	11/19/2023	N	   	8885133385	2025-10-03 00:00:00	03/27/2024	Y	Y	 	112589	                         	                         	                                        	03/27/2024	          	000000000000000	N	00	00	Y	      	      	      	            	           	078958691        	121100782	 	00000000	04/20/2023	2023/04/20	2023/07/18	 	US	YOURHEALTHANDWELLNESS001@GMAIL.COM                                      	yourhealthandwellness001@gmail.com                                      	N	                                	                 	C	         	0000.00000	N	C	N	N	                                	                 	C	         	000.00000	0000.00000	                                	                 	C	         	000.00000	0000.00000	                                	                 	C	         	000.00000	0000.00000	                                	                 	C	         	000.00000	0000.00000	N	N	N	N	                                                                                                                                                                                                                                                                                                                                                                                  	
6759	800000	800126	675900000027730 	MODERN LANE LLC                         	ISO LACE GROUP                          	5969	5969	MODERN MANE LLC          	TAYLORSVILLE 	UT	000084123	8013862895	0000000000	000000000 	0000	0000	6759	0000	921581555	000000000	Y	0000	D	 	 	    	    	    	                	                	0000000000000000	0000000000000000	Y	N	N	N	N	N	N	N	N	N	N	N	N	8000	9	00000000	N	DAVID SCHMIDT            	                         	                         	                         	646038476	000000000	11/30/2023	04/20/2023	04/20/2023	99/99/9999	99/99/9999	99/99/9999	99/99/9999	N	00008	00	00	00	01	00	00	00	00	00	00	00	00	00	00	00	N	B	M	 	 	 	 	 	 	 	 	 	0000	0000	6124897265	601179750000550	 	 	 	 	 	11/21/2023	N	   	8337142479	2025-10-03 00:00:00	11/20/2023	Y	Y	 	112589	                         	                         	                                        	11/20/2023	          	000000000000000	N	00	00	Y	      	      	      	            	           	919002359        	124001545	 	00000000	04/24/2023	2023/04/24	2023/11/13	 	US	SUPPORT@MODERNMANE.COM                                                  	support@modernmane.com                                                  	N	                                	                 	C	         	0000.00000	N	C	N	N	                                	                 	C	         	000.00000	0000.00000	                                	                 	C	         	000.00000	0000.00000	                                	                 	C	         	000.00000	0000.00000	                                	                 	C	         	000.00000	0000.00000	N	N	N	N	                                                                                                                                                                                                                                                                                                                                                                                  	
