Record Type,Field Name,Position start,Position stop,Field Length,Format,Description,Enumeration
LG,VS MKT SPEC AUTH DATA IND/AM CHG DE,104,104,1,AN,"For Visa, the field name is Market-Specific Authorization Data Indicator. The field identifies the type of enriched information that was present and valid in the initial authorization request.For American Express, the field name is Charge Descriptor. The field identifies the type of charge.",
LG,VS Total Auth AMT/AM Tax Amount,105,116,12,N,"For Visa, the field name is Amount Authorized. The field indicates the total amount authorized for the transaction.For American Express, the field name is Tax Assessed. The field indicates the amount of the tax assessed on the transaction.",Format:Blank or999999999999
LG,Property Telephone Number,117,126,10,N,"The telephone number at the lodging location.For Mastercard, the field name is Property Telephone Number.For Discover, the field name is Facility Telephone Number.",
LG,Check Out Date,127,132,6,N,"The departure date of the cardholder from the lodging.For Mastercard, the field name is Check-Out Date.For Discover, the field name is Departure Date.",Allowed format: MMDDYY
LG,MC Prog Code/AM Approval Code,133,134,2,N,"For Mastercard and Discover, the field name is Program Code.The field identifies special circumstances, such as a no-show customer.For American Express, the field name is Approval Code.",
LG,Daily Room Rate,135,146,12,N,"The lodging room rate per day.For Visa the field name is Daily Room Rate.For Mastercard and Discover, the field name is Room Rate.For both associations, this field must be right justified. You can use zeros as filler.",Format:Blank or999999999999
LG,"Total Tax (VS) Room Tax (MC, AM)",147,158,12,N,"For Visa, the field name is Tax Assessed. The field indicates the total amount of tax assessed on the transaction.For Mastercard and Discover, the field name is Room Tax. The field indicates the amount charged for taxes on the room.For all associations, the field must be right justified. You can use zeros as filler.",Format:Blank or999999999999
LG,Total Charges For All Calls,159,170,12,N,"The total amount of all calls made from the room.For Mastercard, the field name is Call Charges.For Discover, the field name is Phone Charges.The field must be right justified. You can use zeros as filler.",Format:Blank or999999999999
LG,Food/Beverage Charges,171,182,12,N,"For Visa, the field name is Food and Beverage Charges.The field indicates the amount of food and beverage charges.For Mastercard and Discover, the field name is Restaurant and Room Service Charges. The field indicates the amount for the restaurant and room service charges.For both associations, the field must be right justified. You can use zeros as filler.",Format:Blank or999999999999
LG,Bar/Mini Bar Charges,183,194,12,N,"The amount of bar or mini-bar charges.For Mastercard the field name is Bar Charges.For Discover, the field name is Mini-Bar Charges.This field must be right justified. You can use zeros as filler.",Format:Blank or999999999999
LG,Gift Shop Charges,195,206,12,N,The amount of gift shop charges.This field must be right justified. You can use zeros as filler.,Format:Blank or999999999999
LG,Laundry/Dry Cleaning Amount,207,218,12,N,The amount of laundry or dry cleaning charges.This field must be right justified. You can use zeros as filler.,Format:Blank or999999999999
LG,Other Services Code,219,221,3,AN,"Additional services for which the cardholder was billed.For Mastercard the field name is Other Services Code.For Discover, the field name is Other Indicator.",
LG,Other Services Charges,222,233,12,N,"The amount charged for the additional services identified in the Other Services Code field.For Mastercard, the field name is Other Services Charges.This field must be right justified. You can use zeros as filler.For Discover, the field name is Other Charges. The field indicates the amount charged for the additional services identified in the Other Indicator field.",Format:Blank or999999999999
LG,Billing Adjustment Indicator,234,234,1,AN,Indicates if additional charges were made on the original transaction.,Allowed values:{Blank} No additional chargesY=Additional charges addedN=No additional charges were added
LG,"Folio Cash ADV (VS)Bill ADJ AMT (MC,AM)",235,246,12,N,"The total amount of adjustments or cash advances charged to the customer's account.For Visa, the field name is Cash Advance Amount.For Mastercard, the field name is Billing Adjustment Amount.For Discover, the field name is Adjustment Amount.",Format:Blank or999999999999
LG,Prepaid Expense,247,258,12,N,The total amount of lodging expenses paid in advance by the customer.,Format:Blank or999999999999
LG,Extension Record Indicator,259,263,5,AN,The code indicates if another extension record follows this record.,
LG,Room Nights,264,265,2,N,The total number of nights spent in the room.,Format:99
LG,Total Room Tax,266,277,12,N,The total amount of tax assessed on the room.,Format:Blank or999999999999
LG,Reserved for future use,278,700,423,AN,,
GE,Sequence Number Area,1,7,7,N,A number to identify the file position within the transmission.,
GE,Entry Run Number,8,13,6,N,,
GE,Sequence Number within entry run,14,17,4,N,,
GE,Record Identifier,18,19,2,AN,The value identifies the type of record.,"Constant value is ""GE"""
GE,Bank Number,20,23,4,AN,The Global Payments  Bank number.,
GE,Merchant Account Number,24,39,16,N,The Global Payments  account number of the merchant.,
GE,Association Number,40,45,6,AN,The identification number of an association to which the merchant reports.,
GE,Group Number,46,51,6,AN,Group number for the merchant.,
GE,Transaction Code,52,55,4,N,A Global Payments  Transaction code identifies the type of record being transmitted.,
GE,Detail Merchant Name,56,76,21,AN,Reserved,
GE,Merchant Soft Descriptor,77,101,25,AN,Reserved,
GE,Reserved for future use,102,700,599,AN,,
E1,Sequence Number Area,1,7,7,N,A number to identify the file position within the transmission.,
E1,Entry Run Number,8,13,6,N,,
E1,Sequence Number within entry run,14,17,4,N,,
E1,Record Identifier,18,19,2,AN,The value identifies the type of record.,"Constant value is ""E1"""
E1,Bank Number,20,23,4,AN,The Global Payments  Bank number.,
E1,Merchant Account Number,24,39,16,N,The Global Payments  account number of the merchant.,
E1,Association Number,40,45,6,AN,The identification number of an association to which the merchant reports.,
E1,Group Number,46,51,6,AN,Group number for the merchant.,
E1,Transaction Code,52,55,4,N,A Global Payments  Transaction code identifies the type of record being transmitted.,
E1,EMV Tran Type,56,57,2,CH,,
E1,EMV Term Cap Profile,58,63,6,CH,,
E1,EMV App Tran Counter,64,67,4,CH,,
E1,EMV Cryptogram Amount,68,82,15,N,,Format:-99999999999.99
E1,EMV ISS Script Results,83,132,50,CH,,
E1,EMV ISS App Data,133,196,64,CH,,
E1,EMV Card Sequence Number,197,200,4,CH,,
E1,EMV Term Country Code,201,204,4,CH,,
E1,EMV App Interchange Profile,205,208,4,CH,,
E1,EMV Term Verify Results,209,218,10,CH,,
E1,EMV Term Tran Date,219,224,6,CH,,
E1,EMV Unpredictable Number,225,232,8,CH,,
E1,EMV Cryptogram,233,248,16,CH,,
E1,EMV Form Factor Indicator,249,256,8,CH,,
E1,EMV Tran Currency Code,257,260,4,CH,,
E1,EMV DED File Name,261,292,32,CH,,
E1,EMVISS Auth Data,293,324,32,CH,,
E1,EMV Tran CAT Code,325,326,2,CH,,
E1,EMV Crypt Info Data,327,330,4,CH,,
E1,EMV Term type,331,332,2,CH,,
E1,EMV Transaction Sequence Number,333,340,8,CH,,
E1,EMV Amount Authorized,341,353,13,N,,Format:-999999999.99
E1,EMV Amount Other,354,366,13,N,,Format:-999999999.99
E1,EMV CVM Result,367,372,6,CH,,
E1,EMV Interface Dev Serial,373,388,16,CH,,
E1,EMV Terminal Application Version,389,392,4,CH,,
E1,EMV Cryptogram Information,393,394,2,CH,,
E1,Reserved for future use,395,700,306,CH,,
G2,Sequence Number Area,1,7,7,N,A number to identify the file position within the transmission.,
G2,Entry Run Number,8,13,6,N,,
G2,Sequence Number within entry run,14,17,4,N,,
G2,Record Identifier,18,19,2,AN,The value identifies the type of record.,"Constant value is ""G2"""
G2,Bank Number,20,23,4,AN,The Global Payments  Bank number.,
G2,Merchant Account Number,24,39,16,N,The Global Payments  account number of the merchant.,
G2,Association Number,40,45,6,AN,The identification number of an association to which the merchant reports.,
G2,Group Number,46,51,6,AN,Group number for the merchant.,
G2,Transaction Code,52,55,4,N,A Global Payments  Transaction code identifies the type of record being transmitted.,
G2,Merchant DBA City,56,80,25,CH,,
G2,Merchant DBA State,81,93,13,CH,,
G2,Terminal Capability,94,94,1,CH,,
G2,Auth data Indicator,95,95,1,CH,,
G2,Visa Acct Funding Source,96,96,1,CH,,
G2,Visa Message Identifier,97,111,15,CH,,
G2,MC Electronic Commerce Security Level,112,112,1,CH,,
G2,Cardholder Authentication,113,113,1,CH,,
G2,UCAF Coll ID,114,114,1,CH,,
G2,MVR Return City,115,132,18,CH,,
G2,Card Acceptance Tax ID,133,152,20,CH,,
G2,CAT Merchant type PRV,153,153,1,CH,,
G2,Cat Owner Type PRV,154,154,1,CH,,
G2,CAT Cert Type PRV,155,155,1,CH,,
G2,Cat Ethnic Type PRV,156,156,1,CH,,
G2,Multiple Clearing Sequence Number,157,158,2,AN,,
G2,VISA Spend Qualified Indicator,159,159,1,AN,,
G2,VISA Product Extension Flag / VISA Account Level Processing Flag,160,161,2,AN,,
G2,Multiple Clearing Sequence Count,162,163,2,AN,,
G2,Token Assurance Level,164,165,2,AN,,
G2,Fuel Type,166,167,2,AN,,
G2,Mastercard Electronic Commerce Security Level,168,170,3,AN,,
G2,Independent Sales Organization ID,171,182,12,AN,,
G2,Payment Facilitator ID,183,194,12,AN,,
G2,Mastercard Business Service Arrangement Type Code,195,195,1,AN,,
G2,Mastercard Business Service ID Code,196,201,6,AN,,
G2,Device Type,202,203,2,AN,,
G2,Transit Program,204,207,4,AN,,
G2,Token Requestor ID,208,218,11,AN,,
G2,Mastercard Mapping Service Indicator,219,219,1,AN,,
G2,Discover Acquirer ID,220,230,11,AN,,
G2,Discover Merchant Account Number,231,246,16,AN,,
G2,Sub-merchant ID,247,261,15,AN,,
G2,Original Terminal ID,262,269,8,AN,Original Terminal ID,
G2,Convenience Fee Amount,270,286,17,N,Convenience Fee Amount calculated based on the Per Item Amount in Express,Format:-9999999999999.99
G2,Split Funding Amount 1,287,303,17,N,Split Funding Amount calculated for the first Split Funding Account,Format:-9999999999999.99
G2,Split Funding Amount 2,304,320,17,N,Split Funding Amount calculated for the second Split Funding Account,Format:-9999999999999.99
G2,Split Funding Amount 3,321,321,17,N,Split Funding Amount calculated for the third Split Funding Account,Format:-9999999999999.99
G2,Split Funding Amount 4,338,354,17,N,Split Funding Amount calculated for the fourth Split Funding Account,Format:-9999999999999.99
G2,Reserved for future use,355,683,329,AN,Filler,
G2,ESID,684,686,3,AN,,
G2,Reserved for future use,687,700,14,AN,Filler,
